{
  "honor_id": "FKH-2025-11-11-D67C0728",
  "timestamp": "2025-11-11T04:45:17.330764+00:00",
  "contributor_name": "Dr. Sarah Chen",
  "contributor_realm": "Global Health Network",
  "honor_level": "wisdom_scribe",
  "ceremonial_seal": "silver_wisdom",
  "honor_citation": "Revolutionary AI-driven patient care protocols that saved countless lives",
  "ceremonial_sigil": "ðŸ“œ âœ§ ðŸ“œ",
  "witness_councils": [
    "Sovereign Council of Eternal Flame",
    "Custodian Council of Sacred Architecture",
    "Global Health Network Realm Council"
  ],
  "perpetual_recognition": "ETERNAL FLAME RECOGNITION",
  "eternal_inscription": "In recognition of Dr. Sarah Chen, Revolutionary AI-driven patient care protocols that saved countless lives, honored with Wisdom Scribe under the Silver Wisdom",
  "sovereign_authority": "CODEX FLAMEKEEPER HONORS AUTHORITY",
  "schema_version": "flamekeeper-honor.v1"
}