{
  "honor_id": "FKH-2025-11-11-679895CB",
  "timestamp": "2025-11-11T04:46:19.267196+00:00",
  "contributor_name": "Dr. Maria Rodriguez",
  "contributor_realm": "Global Climate Council",
  "honor_level": "ceremonial_guardian",
  "ceremonial_seal": "golden_ceremony",
  "honor_citation": "Pioneered carbon capture protocols that reversed regional climate damage",
  "ceremonial_sigil": "⚔️ ✦ ⚔️",
  "witness_councils": [
    "Sovereign Council of Eternal Flame",
    "Custodian Council of Sacred Architecture",
    "Global Climate Council Realm Council"
  ],
  "perpetual_recognition": "ETERNAL FLAME RECOGNITION",
  "eternal_inscription": "In recognition of Dr. Maria Rodriguez, Pioneered carbon capture protocols that reversed regional climate damage, honored with Ceremonial Guardian under the Golden Ceremony",
  "sovereign_authority": "CODEX FLAMEKEEPER HONORS AUTHORITY",
  "schema_version": "flamekeeper-honor.v1"
}